{
  "proposal_id": "prop-20260721-a1b2c3",
  "created_at": "2026-07-21T10:00:00Z",
  "purpose": {
    "plain_language": "Add what we learned about the left motor controller running hot to your project notes, so future work takes it into account.",
    "trigger": "Correction during work session: user pointed out the ESC temperature log from July 18."
  },
  "risk_category": "routine",
  "changes": [
    {
      "path": "memory/hardware-observations.md",
      "action": "modify",
      "before_hash": "3b8ec54d2f8a1c9e7d6b5a4f3e2d1c0b9a8f7e6d5c4b3a2f1e0d9c8b7a6f5e4d",
      "after_hash": "9c1d2e3f4a5b6c7d8e9f0a1b2c3d4e5f6a7b8c9d0e1f2a3b4c5d6e7f8a9b0c1d"
    }
  ],
  "assumptions": ["The July 18 log reflects normal operating conditions, not a one-off."],
  "validations": [
    { "validator": "protected_path_validator", "passed": true, "detail": "no protected-path violations" },
    { "validator": "frontmatter_validator", "passed": true, "detail": "memory index within limits" }
  ],
  "rollback_id": "restore-20260721-0007",
  "expires_at": "2026-07-24T10:00:00Z"
}
