{
  "proposal_id": "prop-20260721-f7a8b9",
  "created_at": "2026-07-21T12:00:00Z",
  "purpose": {
    "plain_language": "Make it impossible - not just discouraged - for the assistant to change motor current limits in firmware config without your explicit approval each time.",
    "trigger": "Interview answer: user identified current limits as safety-critical (stall can overheat the ESC)."
  },
  "risk_category": "safety",
  "changes": [
    {
      "path": "generated/claude-code/.claude/settings.json",
      "action": "modify",
      "before_hash": "2c3d4e5f6a7b8c9d0e1f2a3b4c5d6e7f8a9b0c1d2e3f4a5b6c7d8e9f0a1b2c3d",
      "after_hash": "7e8f9a0b1c2d3e4f5a6b7c8d9e0f1a2b3c4d5e6f7a8b9c0d1e2f3a4b5c6d7e8f"
    },
    {
      "path": "decisions/records/DN-0004-current-limit-guard.md",
      "action": "create",
      "before_hash": null,
      "after_hash": "4d5e6f7a8b9c0d1e2f3a4b5c6d7e8f9a0b1c2d3e4f5a6b7c8d9e0f1a2b3c4d5e"
    }
  ],
  "assumptions": [],
  "validations": [
    { "validator": "protected_path_validator", "passed": true, "detail": "no protected-path violations" },
    { "validator": "provenance_validator", "passed": true, "detail": "safety claim traces to user statement U-03 (interview round 2)" }
  ],
  "rollback_id": "restore-20260721-0009",
  "expires_at": "2026-07-22T12:00:00Z"
}
